{
  "schemaVersion": 1,
  "scope": "site",
  "architectureStyle": "diagram",
  "structures": [
    {
      "structureId": "manor",
      "displayName": "Manor House",
      "kind": "building",
      "boundary": {
        "shape": "hull",
        "vertices": [
          { "x": 38, "y": 38 },
          { "x": 58, "y": 38 },
          { "x": 58, "y": 62 },
          { "x": 38, "y": 62 }
        ]
      }
    },
    {
      "structureId": "keep",
      "displayName": "Round Keep",
      "kind": "building",
      "boundary": {
        "shape": "hull",
        "vertices": [
          { "x": 68, "y": 42 },
          { "x": 82, "y": 42 },
          { "x": 82, "y": 58 },
          { "x": 68, "y": 58 }
        ]
      }
    }
  ],
  "scenes": [
    {
      "sceneId": "scene-hall",
      "structureId": "manor",
      "mapLevel": 0,
      "mapShape": "rect",
      "mapSize": { "w": 18, "h": 12 },
      "layout": { "x": 48, "y": 50 }
    },
    {
      "sceneId": "scene-kitchen",
      "structureId": "manor",
      "mapLevel": 0,
      "mapShape": "rect",
      "mapSize": { "w": 14, "h": 10 },
      "layout": { "x": 48, "y": 58 }
    },
    {
      "sceneId": "scene-keep",
      "structureId": "keep",
      "mapLevel": 0,
      "mapShape": "circle",
      "mapSize": { "w": 16, "h": 16 },
      "layout": { "x": 75, "y": 50 }
    },
    {
      "sceneId": "scene-bailey",
      "mapLevel": 0,
      "mapShape": "rect",
      "mapSize": { "w": 20, "h": 14 },
      "layout": { "x": 72, "y": 72 }
    }
  ],
  "edges": [
    {
      "exitId": "hall-kitchen-door",
      "sourceSceneId": "scene-hall",
      "targetSceneId": "scene-kitchen",
      "kind": "door",
      "travelSteps": 1,
      "crossesStructure": false
    },
    {
      "exitId": "manor-bailey-gate",
      "sourceSceneId": "scene-hall",
      "targetSceneId": "scene-bailey",
      "kind": "path",
      "travelSteps": 2,
      "crossesStructure": true
    }
  ],
  "worldMap": {
    "bounds": { "minX": 0, "minY": 0, "maxX": 100, "maxY": 100 },
    "terrain": [],
    "structurePlacements": [
      { "structureId": "manor", "origin": { "x": 45, "y": 40 } },
      { "structureId": "keep", "origin": { "x": 72, "y": 50 } }
    ]
  }
}
