{
  "schemaVersion": 1,
  "scope": "stack",
  "architectureStyle": "diagram",
  "structures": [
    {
      "structureId": "manor",
      "displayName": "Manor House",
      "kind": "building"
    }
  ],
  "scenes": [
    {
      "sceneId": "scene-hall",
      "structureId": "manor",
      "mapLevel": 0,
      "levelLabel": "Ground floor",
      "mapShape": "rect",
      "mapSize": { "w": 18, "h": 12 },
      "layout": { "x": 50, "y": 50 },
      "planPosition": { "planX": 12, "planY": 10 }
    },
    {
      "sceneId": "scene-hall-upper",
      "structureId": "manor",
      "mapLevel": 1,
      "levelLabel": "Upper gallery",
      "mapShape": "rect",
      "mapSize": { "w": 18, "h": 10 },
      "layout": { "x": 50, "y": 50 },
      "planPosition": { "planX": 12, "planY": 10 }
    }
  ],
  "verticalEdges": [
    {
      "exitId": "hall-stairs-up",
      "sourceSceneId": "scene-hall",
      "targetSceneId": "scene-hall-upper",
      "kind": "stairs",
      "levelDelta": 1,
      "planPosition": { "planX": 12, "planY": 10 }
    }
  ]
}
