{
  "schemaVersion": 1,
  "scope": "mini",
  "architectureStyle": "diagram",
  "structures": [
    {
      "structureId": "manor",
      "displayName": "Manor House",
      "kind": "building",
      "boundary": {
        "shape": "hull",
        "vertices": [
          { "x": 38, "y": 35 },
          { "x": 62, "y": 35 },
          { "x": 62, "y": 65 },
          { "x": 38, "y": 65 }
        ]
      }
    }
  ],
  "scenes": [
    {
      "sceneId": "scene-hall",
      "structureId": "manor",
      "mapLevel": 0,
      "levelLabel": "Ground floor",
      "mapShape": "rect",
      "mapSize": { "w": 18, "h": 12 },
      "layout": { "x": 50, "y": 42 },
      "planPosition": { "planX": 12, "planY": 10 }
    },
    {
      "sceneId": "scene-kitchen",
      "structureId": "manor",
      "mapLevel": 0,
      "levelLabel": "Ground floor",
      "mapShape": "rect",
      "mapSize": { "w": 14, "h": 10 },
      "layout": { "x": 50, "y": 58 },
      "planPosition": { "planX": 12, "planY": 18 }
    }
  ],
  "edges": [
    {
      "exitId": "hall-kitchen-door",
      "sourceSceneId": "scene-hall",
      "targetSceneId": "scene-kitchen",
      "kind": "door",
      "travelSteps": 1,
      "direction": "N",
      "exitAnchor": { "side": "N", "offset": 0.5 },
      "crossesStructure": false
    }
  ]
}
